{
  "$schema": "https://json-schema.org/draft/2020-12/schema",
  "title": "Content Evaluator Direct Output",
  "description": "3축 판정. content_fidelity와 functional_integrity는 functional_test가 브라우저 실측으로 판정하므로 여기 없다 (docs/pipeline-redesign.md 5.5).",
  "type": "object",
  "required": [
    "rubric_name",
    "verdict",
    "rubric_scores",
    "axis_rationales",
    "weak_axes",
    "calibration_note"
  ],
  "properties": {
    "rubric_name": {
      "type": "string",
      "const": "content-html:v5"
    },
    "verdict": {
      "type": "string",
      "enum": ["PASS", "REJECT"]
    },
    "rubric_scores": {
      "type": "object",
      "required": ["scores", "weights", "weighted_total"],
      "properties": {
        "scores": {
          "type": "object",
          "required": [
            "learning_goal_alignment",
            "feedback_scaffolding",
            "interaction_flow_clarity"
          ],
          "properties": {
            "learning_goal_alignment": { "type": "number", "minimum": 0, "maximum": 5 },
            "feedback_scaffolding": { "type": "number", "minimum": 0, "maximum": 5 },
            "interaction_flow_clarity": { "type": "number", "minimum": 0, "maximum": 5 }
          },
          "additionalProperties": false
        },
        "weights": {
          "type": "object",
          "required": [
            "learning_goal_alignment",
            "feedback_scaffolding",
            "interaction_flow_clarity"
          ],
          "properties": {
            "learning_goal_alignment": { "type": "number", "const": 0.37 },
            "feedback_scaffolding": { "type": "number", "const": 0.33 },
            "interaction_flow_clarity": { "type": "number", "const": 0.3 }
          },
          "additionalProperties": false
        },
        "weighted_total": {
          "type": "number",
          "minimum": 0,
          "maximum": 5
        }
      },
      "additionalProperties": false
    },
    "axis_rationales": {
      "type": "object",
      "required": [
        "learning_goal_alignment",
        "feedback_scaffolding",
        "interaction_flow_clarity"
      ],
      "properties": {
        "learning_goal_alignment": { "type": "string", "minLength": 1 },
        "feedback_scaffolding": { "type": "string", "minLength": 1 },
        "interaction_flow_clarity": { "type": "string", "minLength": 1 }
      },
      "additionalProperties": false
    },
    "weak_axes": {
      "type": "array",
      "items": {
        "$ref": "#/$defs/contentAxis"
      }
    },
    "calibration_note": {
      "type": "string",
      "minLength": 1
    }
  },
  "$defs": {
    "contentAxis": {
      "type": "string",
      "enum": [
        "learning_goal_alignment",
        "feedback_scaffolding",
        "interaction_flow_clarity"
      ]
    }
  },
  "additionalProperties": false
}
